title,description
Event Coordinator,"Ask other people a questionAsk other people a questionPosting publicly. Learn more(function(){var a=document.querySelector(""#taw""),b=document.querySelector(""#topstuff"");if(a&&!a.clientHeight&&b&&!b.clientHeight)for(var c=document.querySelector(""#rso"").children,d=0;d<c.length;++d)if(0<c[d].clientHeight){var e=c[d].querySelector(""div g-section-with-header"");e&&(e.style.marginTop=0);break};}).call(this);Thanks for the upvote. Do you want to be notified when others post answers to this question?YesFollowing this question. You'll get notifications when people post new answers to this question."
Event Executive,"Ask other people a questionAsk other people a questionPosting publicly. Learn more(function(){var a=document.querySelector(""#taw""),b=document.querySelector(""#topstuff"");if(a&&!a.clientHeight&&b&&!b.clientHeight)for(var c=document.querySelector(""#rso"").children,d=0;d<c.length;++d)if(0<c[d].clientHeight){var e=c[d].querySelector(""div g-section-with-header"");e&&(e.style.marginTop=0);break};}).call(this);Thanks for the upvote. Do you want to be notified when others post answers to this question?YesFollowing this question. You'll get notifications when people post new answers to this question."
Event Manager,"Some designers work for home furnishings stores, providing design services to help customers choose materials and furnishings. Some interior designers produce designs, plans, and drawings for construction and installation. This may include floor plans, electrical layouts, and plans needed for building permits."
Examiner,"Q&A on GoogleCan anyone give me suggestion on if this interior designer is good or not ?Reporta week agoAnswerI want to be a interior designer. And I have creative skills for interior designing . But I don't ...Report4 weeks agoAnswerIs there any field in MBA related to interior designer ?Reporta month agoAnswerWhat do interior designers study in college?Report5 months agoAnswer(function(){google.sc=google.sc||{};google.sc.init=function(b,e,q,f,h,k,r){if((b=document.getElementById(b))&&(0!=b.offsetWidth||0!=b.offsetHeight)){var l=b.querySelector(""div""),m=l.querySelector(""div""),c=0,g=l.scrollWidth-l.offsetWidth;if(0<e){var n=m.children;c=n[e].offsetLeft-n[0].offsetLeft;if(f){for(var p=c=0;p<e;++p)c+=n[p].offsetWidth;c=Math.min(g,c)}}c+=q;e=Math.min(f?g-c:c,g);l.scrollLeft=f&&(h||r)?c:f&&k?-c:e;var a=b.getElementsByTagName(""g-left-button"")[0],d=b.getElementsByTagName(""g-right-button"")[0];a&&d&&(h=/\btHT0l\b/,k=/\bpQXcHc\b/,a.className=a.className.replace(h,""""),d.className=d.className.replace(h,""""),0==e?a.className=""pQXcHc ""+a.className:a.className=a.className.replace(k,""""),e==g?d.className=""pQXcHc ""+d.className:d.className=d.className.replace(k,""""),0<=a.className.indexOf(""SL0Gp"")&&0==e&&e==g&&(m.style.paddingLeft=""0px"",m.style.paddingRight=""0px"",a.style.display=""none"",d.style.display=""none"",b.style.paddingLeft=f?""0px"":""48px"",b.style.paddingRight=f?""48px"":""0px"",b.style.textAlign=f?""left"":""right"",document.getElementById(""fade_forward"").style.display=
""none"",document.getElementById(""fade_reverse"").style.display=""none""),setTimeout(function(){a.className+="" tHT0l"";d.className+="" tHT0l""},50))}};}).call(this);(function(){var id='_VfNwXcaxHYWGmgff-I_4Bw15';var index=0;var offset=0;var is_rtl=false;var is_ie=false;var is_gecko=false;var is_edge=false;google.sc.init(id,index,offset,is_rtl,is_ie,is_gecko,is_edge);})();Ask other people a questionPosting publicly. Learn more(function(){var a=document.querySelector(""#taw""),b=document.querySelector(""#topstuff"");if(a&&!a.clientHeight&&b&&!b.clientHeight)for(var c=document.querySelector(""#rso"").children,d=0;d<c.length;++d)if(0<c[d].clientHeight){var e=c[d].querySelector(""div g-section-with-header"");e&&(e.style.marginTop=0);break};}).call(this);Thanks for the upvote. Do you want to be notified when others post answers to this question?YesFollowing this question. You'll get notifications when people post new answers to this question."
Examiner Of Patents & Designs,"Q&A on GoogleCan anyone give me suggestion on if this interior designer is good or not ?Reporta week agoAnswerI want to be a interior designer. And I have creative skills for interior designing . But I don't ...Report4 weeks agoAnswerIs there any field in MBA related to interior designer ?Reporta month agoAnswerWhat do interior designers study in college?Report5 months agoAnswer(function(){google.sc=google.sc||{};google.sc.init=function(b,e,q,f,h,k,r){if((b=document.getElementById(b))&&(0!=b.offsetWidth||0!=b.offsetHeight)){var l=b.querySelector(""div""),m=l.querySelector(""div""),c=0,g=l.scrollWidth-l.offsetWidth;if(0<e){var n=m.children;c=n[e].offsetLeft-n[0].offsetLeft;if(f){for(var p=c=0;p<e;++p)c+=n[p].offsetWidth;c=Math.min(g,c)}}c+=q;e=Math.min(f?g-c:c,g);l.scrollLeft=f&&(h||r)?c:f&&k?-c:e;var a=b.getElementsByTagName(""g-left-button"")[0],d=b.getElementsByTagName(""g-right-button"")[0];a&&d&&(h=/\btHT0l\b/,k=/\bpQXcHc\b/,a.className=a.className.replace(h,""""),d.className=d.className.replace(h,""""),0==e?a.className=""pQXcHc ""+a.className:a.className=a.className.replace(k,""""),e==g?d.className=""pQXcHc ""+d.className:d.className=d.className.replace(k,""""),0<=a.className.indexOf(""SL0Gp"")&&0==e&&e==g&&(m.style.paddingLeft=""0px"",m.style.paddingRight=""0px"",a.style.display=""none"",d.style.display=""none"",b.style.paddingLeft=f?""0px"":""48px"",b.style.paddingRight=f?""48px"":""0px"",b.style.textAlign=f?""left"":""right"",document.getElementById(""fade_forward"").style.display=
""none"",document.getElementById(""fade_reverse"").style.display=""none""),setTimeout(function(){a.className+="" tHT0l"";d.className+="" tHT0l""},50))}};}).call(this);(function(){var id='_WvNwXaGzL-jCz7sPuvea-Aw16';var index=0;var offset=0;var is_rtl=false;var is_ie=false;var is_gecko=false;var is_edge=false;google.sc.init(id,index,offset,is_rtl,is_ie,is_gecko,is_edge);})();Ask other people a questionPosting publicly. Learn more(function(){var a=document.querySelector(""#taw""),b=document.querySelector(""#topstuff"");if(a&&!a.clientHeight&&b&&!b.clientHeight)for(var c=document.querySelector(""#rso"").children,d=0;d<c.length;++d)if(0<c[d].clientHeight){var e=c[d].querySelector(""div g-section-with-header"");e&&(e.style.marginTop=0);break};}).call(this);Thanks for the upvote. Do you want to be notified when others post answers to this question?YesFollowing this question. You'll get notifications when people post new answers to this question."
Examiner Of Trade Marks,"Ask other people a questionAsk other people a questionPosting publicly. Learn more(function(){var a=document.querySelector(""#taw""),b=document.querySelector(""#topstuff"");if(a&&!a.clientHeight&&b&&!b.clientHeight)for(var c=document.querySelector(""#rso"").children,d=0;d<c.length;++d)if(0<c[d].clientHeight){var e=c[d].querySelector(""div g-section-with-header"");e&&(e.style.marginTop=0);break};}).call(this);Thanks for the upvote. Do you want to be notified when others post answers to this question?YesFollowing this question. You'll get notifications when people post new answers to this question."
Excise Assistant,Marketing Intern Responsibilities Include: Collecting quantitative and qualitative data from marketing campaigns. Performing market analysis and research on competition. Supporting the marketing team in daily administrative tasks.
Excise Executive,"An architectural intern will be in the office daily assisting on all aspects of architectural design, from presentations for clients to working with the construction team. ... An intern may also be conducting research on sites, such as zoning laws and rules that apply for out-of-state projects."
Excise Incharge,Related searchDifferent business majorsView 3+ moreView 3+International businessHuman resource managementMarketingAccountingFinanceReal EstateSales
Excise Manager,Trade marketing managers are responsible for local brand development and selling to companies who can then distribute to their customers. Their target audience will include distributors and retailers who can get the product in front of consumers.
Excise Officer,"Travel Consultant job profile They are responsible for advising clients about suitable travel options in accordance with their needs, wants and capabilities. In addition, they help them plan trips to domestic or international destinations, tours, accommodation, transport, insurance and fares."
Execution Engineer,"Job description: Digital marketing executive. Digital marketing executives oversee the online marketing strategy for their organisation. They plan and execute digital (including email) marketing campaigns and design, maintain and supply content for the organisation's website(s).Mar 24, 2016"
Executive,Related searchCrime and investigation booksView 2+ moreView 2+Criminal Investigation: An Introd...Techniques of crime scene in...Practical Gambling Investiga...When the Dogs Don't Ba...Introduction to Criminal...MindhunterHandbook of Criminal...
Executive Analyst,"Financial Advisor Responsibilities: Talking to clients to determine their expenses, income, insurance coverage, financial objectives, tax status, risk tolerance, or other information needed to develop a financial plan. Answering client questions about financial plans and strategies and giving financial advice.Jul 23, 2019"
Executive Architect,"An investment consultant provides investors with investment products, advice and/or planning. Investment consultants do in-depth work on formulating clients' investment strategies, helping them fulfill their needs and reach their financial goals.Dec 8, 2017"
Executive Assistant To Chief Executive Officer,"Related searchWhat are the different Java platformsJava Platform, Enterpris...Java Platform, Standar...Java API for RESTful...Hibernate"
Executive Assistant To Director,"BSNL JTO Salary in hand, Allowances & Structure BSN JTO is one of the popular jobs among Non- technical engineers. The basic pay scale for JTO in Executive cadre of E1 is Rs. 16,400 â€“ 40,500. The annual average salary of a JTO varies in between Rs. 4.5 lacs â€“ 6 lacs. There is an additional pay revision for employees."
Executive Assistant To Managing Director,"A Java developer is responsible for many duties throughout the development lifecycle of applications, from concept and design right through to testing. ... Conduct software analysis, programming, testing and debugging. Identifying production and non-production application issues. Transforming requirements into stipulations."
Executive Commercial,"A Java developer is responsible for many duties throughout the development lifecycle of applications, from concept and design right through to testing. Here are some other responsibilities they may have: Design, implement and maintain java application phases. ... Develop, test, implement and maintain application software."
Executive Consultant,"Related searchWhat are the different Java platformsJava Platform, Enterpris...Java Platform, Standar...Java API for RESTful...Hibernate"
Executive EDP,Assistant Director Responsibilities Include: Assisting in developing and implementing plans and goals for the department. Working with the director to coordinate and supervise daily operations. Ensuring compliance with regulations and internal policies.
Executive Editor,Related searchesView 3+ moreView 3+Writer job descriptionEditor job descriptionMedia job descriptionJob description and salaryCopywriter job descriptionSocial media manager...IT manager job desc...
Executive Engineer,"Journalist: job description. Journalists research, write, edit, proofread and file news stories, features and articles for use on television and radio or within magazines, journals and newspapers, in print and online."
Executive Engineer Civil,Related searchesLawyer job descriptionParalegal job descriptionClerk job descriptionIT Officer job descriptionSecretary job descriptionIT Engineer job desc...IT Technician job desc...
Executive House Keeper,Other Requirements: Prior related work experi...
Executive Leisure,"ABAP Developer Responsibilities and Duties. Manage design, development and implementation of ABAP projects. Review and revise technical designs to meet ABAP project requirements. ... Provide high quality customer support throughout the project."
Executive MIS,Junior Accountant Job Duties: Maintains financial records for subsidiary companies by analyzing balance sheets and general ledger accounts. ... Provides financial status information by preparing special reports; completing special projects. Corrects errors by posting adjusting journal entries.
Executive Manager,"Main responsibilities-Junior Lawyer Job Description Advise and assist on legal matters in connection with activities. ... Work with the Legal Services Manager to ensure legal best practice, efficiency and effectiveness of procedures and methodologies of the Agency."
Executive Marketing,"Your main responsibility as Associate is to deal with customers and their inquiries. ... The SBI Junior Associate Job Profile also entails marketing financial products of the bank such as loans, schemes, deposits, funds, to potential customers etc."
Executive Merchandiser,Related searchBest paying engineering jobsElectrical engineeringMechanical EngineeringCivil EngineeringAerospace Engineering
Executive Merchandising,"Related searchGeneral office clerks similar professionsInformation ClerksBookkeeping, Accounting, and Audi...Customer service representativeMaterial Recording Clerks"
Executive Microbiologist,"LEGAL COUNSEL SUMMARY OF FUNCTIONS Legal counsel, or general counsel, represents the organization in legal disputes. They advise executives and/or the Board of Directors about legal issues related to the organization's business activities (e.g., government regulations, contracts, property, taxes, labor)."
Executive Networks,"A Junior Graphic Designer will lay out pages, draw logos, redraw logos, rework text, perform color corrections and overall take on the basic duties that help them get to know the ins and outs of graphic design. ... In general, Junior Graphic Designers have a degree in graphic design and have zero to two years' experience."
Executive Officer,"Medical doctors examine, diagnose and treat patients. They can specialize in a number of medical areas, such as pediatrics, anesthesiology or cardiology, or they can work as general practice physicians. ... Medical doctors need state licensure, and certification may also be required for some specialists."
Executive P&A,Related searchFields of engineeringCivil EngineeringElectrical engineeringStructural engineeringChemical EngineeringEnvironmental engineeringComputer Engineering
Executive Personnel & Administration,"Electrical Engineer Job Duties: Evaluates electrical systems, products, components, and applications by designing and conducting research programs; applying knowledge of electricity and materials. Confirms system's and components' capabilities by designing testing methods; testing properties."
Executive Producer,A Junior Engineer is an entry position for a full pledged Engineering profession. A Junior Engineer works under the supervision of an Engineer. He is not expected to function as an Engineer and is also not at liberty to make decisions associated with work techniques and systems.
Executive Sales Manager,Legal Assistant Job Duties: Helps develop cases by maintaining contact with people involved in the case; scheduling depositions; preparing and forwarding summonses and subpoenas; drafting complaints; preparing and filing discovery requests; preparing responses to opposing counsel; generating status reports.
Executive Secretary,"Software Developer duties and responsibilities of the job Researching, designing, implementing and managing software programs. Testing and evaluating new programs. Identifying areas for modification in existing programs and subsequently developing these modifications. Writing and implementing efficient code."
Executive Secretary To CMD,"They work closely with information technology staff, managers, and end users in their organizations or client organizations to develop, maintain, and test computer programs. Computer programmers respond to notifications by users of flaws in programs, identify malfunctioning code, and rewrite programs."
Executive Secretary To Chairman,"A sous chef operates as an executive chef's right hand. A junior sous chef operates as the assistant to a sous chef, which means he is responsible for a majority of the same duties and responsibilities, such as inventory, kitchen staff management and food preparation."
Executive Secretary To Chief Executive Officer,"Junior Designer Responsibilities Include: Participating in various design projects from concept to completion. Producing drafts, prototypes and engaging design solutions. Listening to feedback to hone skills and improve design."
Executive Secretary To Director,Other Requirements: Military rank of SPC/E-4 or ...
Executive Secretary To General Manager,"Ask other people a questionAsk other people a questionPosting publicly. Learn more(function(){var a=document.querySelector(""#taw""),b=document.querySelector(""#topstuff"");if(a&&!a.clientHeight&&b&&!b.clientHeight)for(var c=document.querySelector(""#rso"").children,d=0;d<c.length;++d)if(0<c[d].clientHeight){var e=c[d].querySelector(""div g-section-with-header"");e&&(e.style.marginTop=0);break};}).call(this);Thanks for the upvote. Do you want to be notified when others post answers to this question?YesFollowing this question. You'll get notifications when people post new answers to this question."
Executive Secretary To Managing Director,"Kitchen designers create kitchens for clients, taking into account things like cabinets, flooring, counters and appliances. They use their skills to determine a client's project goals, prepare final plans and create a timeline for the project."
Executive Serviceman,"Ask other people a questionAsk other people a questionPosting publicly. Learn more(function(){var a=document.querySelector(""#taw""),b=document.querySelector(""#topstuff"");if(a&&!a.clientHeight&&b&&!b.clientHeight)for(var c=document.querySelector(""#rso"").children,d=0;d<c.length;++d)if(0<c[d].clientHeight){var e=c[d].querySelector(""div g-section-with-header"");e&&(e.style.marginTop=0);break};}).call(this);Thanks for the upvote. Do you want to be notified when others post answers to this question?YesFollowing this question. You'll get notifications when people post new answers to this question."
Executive Software Development,"A kitchen manager is responsible for the overall operations for the back of house and kitchen area of a restaurant. Kitchen managers hire staff, purchase food and stock, and make sure everyone is trained on proper food preparation and kitchen safety techniques.Apr 12, 2013"
Executive Sous Chef,"Kitchen Manager responsibilities include supervising the food prep and cooking, maintaining a fully-stocked kitchen inventory and complying with safety and cleanliness standards. To be successful in this role, you should be able to manage our kitchen staff and guide them to deliver quality food on time."
Executive Supply Chain Management,"Q&A on GoogleHow much I can make as kitchen supervisor without any diploma and degree??Report2 days agoAnswer(function(){google.sc=google.sc||{};google.sc.init=function(b,e,q,f,h,k,r){if((b=document.getElementById(b))&&(0!=b.offsetWidth||0!=b.offsetHeight)){var l=b.querySelector(""div""),m=l.querySelector(""div""),c=0,g=l.scrollWidth-l.offsetWidth;if(0<e){var n=m.children;c=n[e].offsetLeft-n[0].offsetLeft;if(f){for(var p=c=0;p<e;++p)c+=n[p].offsetWidth;c=Math.min(g,c)}}c+=q;e=Math.min(f?g-c:c,g);l.scrollLeft=f&&(h||r)?c:f&&k?-c:e;var a=b.getElementsByTagName(""g-left-button"")[0],d=b.getElementsByTagName(""g-right-button"")[0];a&&d&&(h=/\btHT0l\b/,k=/\bpQXcHc\b/,a.className=a.className.replace(h,""""),d.className=d.className.replace(h,""""),0==e?a.className=""pQXcHc ""+a.className:a.className=a.className.replace(k,""""),e==g?d.className=""pQXcHc ""+d.className:d.className=d.className.replace(k,""""),0<=a.className.indexOf(""SL0Gp"")&&0==e&&e==g&&(m.style.paddingLeft=""0px"",m.style.paddingRight=""0px"",a.style.display=""none"",d.style.display=""none"",b.style.paddingLeft=f?""0px"":""48px"",b.style.paddingRight=f?""48px"":""0px"",b.style.textAlign=f?""left"":""right"",document.getElementById(""fade_forward"").style.display=
""none"",document.getElementById(""fade_reverse"").style.display=""none""),setTimeout(function(){a.className+="" tHT0l"";d.className+="" tHT0l""},50))}};}).call(this);(function(){var id='_y_RwXfPQDbz7z7sP_a240Ak16';var index=0;var offset=0;var is_rtl=false;var is_ie=false;var is_gecko=false;var is_edge=false;google.sc.init(id,index,offset,is_rtl,is_ie,is_gecko,is_edge);})();Ask other people a questionPosting publicly. Learn more(function(){var a=document.querySelector(""#taw""),b=document.querySelector(""#topstuff"");if(a&&!a.clientHeight&&b&&!b.clientHeight)for(var c=document.querySelector(""#rso"").children,d=0;d<c.length;++d)if(0<c[d].clientHeight){var e=c[d].querySelector(""div g-section-with-header"");e&&(e.style.marginTop=0);break};}).call(this);Thanks for the upvote. Do you want to be notified when others post answers to this question?YesFollowing this question. You'll get notifications when people post new answers to this question."
Executive Tours,"Prepare cooking ingredients by washing and chopping vegetables, cutting meat etc. Undertake basic cooking duties such as reducing sauces, parboiling food etc. Prepare simple dishes such as salads, entrees etc. Maintain a clean and orderly kitchen by washing dishes, sanitizing surfaces, taking out trash etc."
Executive Trainee,"L1 support typically includes individuals that have very limited technical expertise. L1 support logs, categorizes, prioritizes, tracks, and routes (i) incidents reported by users or (ii) alarms raised by monitoring tools. L1 is intended to be the first to acknowledge an incident.Sep 6, 2017"
Executive Vice President,Network administrators are responsible for maintaining computer networks and solving any problems that may occur with them. Typical responsibilities of the job include: installing and configuring computer networks and systems. identifying and solving any problems that arise with computer networks and systems.
Executive Visual Merchandiser,"It can be said LIC agency is not a job but a business. You will be an entrepreneur, without much investment. Your role is to create awareness about LIC and make people understand the importance of Life insurance. You can introduce LIC policy as a tool for financial planning.Jan 21, 2018"
Exhibition Designer,Related searchesView 2+ moreView 2+Microbiologist job descriptionPathologist job descriptionBiochemist job descriptionBiomedical scientist job desc...Biotechnology job descriptionResearch scientist job desc...Forensic science job desc...
Exim Assistant,"Laboratory Manager Job Duties: Maintains medical laboratory equipment performance by establishing quality standards; developing operations, quality, and troubleshooting procedures; ensuring staff compliance; certifying instrument performance; arranging equipment replacement, service, and repair."
Exim Executive,"Essential Information. Medical technologists, also known as clinical laboratory technologists, perform and analyze the results of complex scientific tests on blood and bodily fluids. These highly trained professionals work in hospitals and independent laboratories using sophisticated procedures and equipment."
Exim Manager,"Job Description As a Student Welfare Officer (SWO), your main role is to provide social support to the students at-risk under your charge, which may include working with their families and other community partners to address barriers to learning and strengthening the safety net for these students.May 9, 2019"
Exim Officer,Related searchesQuantity surveyor job desc...IT Engineer job desc...Architect job descriptionBricklayer job descriptionIndustrial designer job desc...Electrician job description
Export Assistant,"Landscape architects typically do the following: Meet with clients, engineers, and building architects to understand the requirements of a project. Prepare site plans, specifications, and cost estimates. Coordinate the arrangement of existing and proposed land features and structures."
Export Coordinator,"Landscape architects typically do the following: Confer with clients, engineers, and building architects to understand a project. Prepare site plans, specifications, and cost estimates. Coordinate the arrangement of existing and proposed land features and structures."
Export Documentation Assistant,Related searchWriting based careersView 3+ moreView 3+Copy editingProofreadingEditingProfessional writingReviewTranslationCommissioning editor
Export Documentation Executive,Related searchLanguage teaching booksView 3+ moreView 3+On Being a Languag...Teaching Languages OnlineThe Language Teacher...Grammar for English Languag...Approaches and Methods...How Languages are Lear...Practical English Usage
Export Documentation Incharge,"Ask other people a questionAsk other people a questionPosting publicly. Learn more(function(){var a=document.querySelector(""#taw""),b=document.querySelector(""#topstuff"");if(a&&!a.clientHeight&&b&&!b.clientHeight)for(var c=document.querySelector(""#rso"").children,d=0;d<c.length;++d)if(0<c[d].clientHeight){var e=c[d].querySelector(""div g-section-with-header"");e&&(e.style.marginTop=0);break};}).call(this);Thanks for the upvote. Do you want to be notified when others post answers to this question?YesFollowing this question. You'll get notifications when people post new answers to this question."
