title,description
ABAP Consultant,"SAP ABAP Consultants are responsible for developing SAP business applications using SAP Standard programming language ABAP, the main roles and responsibilities of SAP ABAP Consultant are... SAP ABAP Consultants play crucial role in the implementation of SAP software for an organisation.Apr 5, 2018"
ABAP Developer,"Duties. The SAP administrator is in charge of maintaining computer systems and customer support in relation to systems used by a particular company. In addition, they are often charged with the tasks of preparing reports and developing long-term strategies for the SAP team.Feb 19, 2019"
ABAP Programmer,"Ask other people a questionAsk other people a questionPosting publicly. Learn more(function(){var a=document.querySelector(""#taw""),b=document.querySelector(""#topstuff"");if(a&&!a.clientHeight&&b&&!b.clientHeight)for(var c=document.querySelector(""#rso"").children,d=0;d<c.length;++d)if(0<c[d].clientHeight){var e=c[d].querySelector(""div g-section-with-header"");e&&(e.style.marginTop=0);break};}).call(this);Thanks for the upvote. Do you want to be notified when others post answers to this question?YesFollowing this question. You'll get notifications when people post new answers to this question."
AC Operator,"Technicians are skilled workers that work with complex systems or perform highly technical mechanical or diagnostic tests. Depending on the field, technicians may work independently or under the direction of a professional. Technicians can work indoors or might spend most of their time outside.Feb 21, 2013"
AC Technician,"Assistant Systems Engineer - Job Description. Under general supervision, assists in analyzing, planning, implementing, maintaining, troubleshooting and enhancing large complex systems or networks consisting of a combination that may include servers, mainframes, mini-computers, LANS, WANs."
AME Trainee,"Video Editors are generally responsible for editing and assembling recorded raw material into a suitable, finished product ready for broadcasting. The material may include camera footage, dialogue, sound effects, graphics and special effects."
ASC Head,Roles and Responsibilities: SAP HR Technical Consultant will be part of project team which handles upgrade and rollout. ... SAP HR Technical Consultant will analyze and propose technical solutions and develop technical requirements based on Functional Specifications.
ASE,"Ask other people a questionAsk other people a questionPosting publicly. Learn more(function(){var a=document.querySelector(""#taw""),b=document.querySelector(""#topstuff"");if(a&&!a.clientHeight&&b&&!b.clientHeight)for(var c=document.querySelector(""#rso"").children,d=0;d<c.length;++d)if(0<c[d].clientHeight){var e=c[d].querySelector(""div g-section-with-header"");e&&(e.style.marginTop=0);break};}).call(this);Thanks for the upvote. Do you want to be notified when others post answers to this question?YesFollowing this question. You'll get notifications when people post new answers to this question."
ASE Trainee,"Ask other people a questionAsk other people a questionPosting publicly. Learn more(function(){var a=document.querySelector(""#taw""),b=document.querySelector(""#topstuff"");if(a&&!a.clientHeight&&b&&!b.clientHeight)for(var c=document.querySelector(""#rso"").children,d=0;d<c.length;++d)if(0<c[d].clientHeight){var e=c[d].querySelector(""div g-section-with-header"");e&&(e.style.marginTop=0);break};}).call(this);Thanks for the upvote. Do you want to be notified when others post answers to this question?YesFollowing this question. You'll get notifications when people post new answers to this question."
AV Editor,"Ask other people a questionAsk other people a questionPosting publicly. Learn more(function(){var a=document.querySelector(""#taw""),b=document.querySelector(""#topstuff"");if(a&&!a.clientHeight&&b&&!b.clientHeight)for(var c=document.querySelector(""#rso"").children,d=0;d<c.length;++d)if(0<c[d].clientHeight){var e=c[d].querySelector(""div g-section-with-header"");e&&(e.style.marginTop=0);break};}).call(this);Thanks for the upvote. Do you want to be notified when others post answers to this question?YesFollowing this question. You'll get notifications when people post new answers to this question."
Abap Human Resources Consultant,"Q&A on GoogleWhat is career group? In context of employees job description.Report2 weeks agoAnswerwhat are the chiller plant Helpers Job Description ?Report5 months agoAnswerWhat is the Job profile of naval officer in tech entryReport3 months agoAnswerWhat is a cleaning supervisor job description?Report9 months agoAnswer(function(){google.sc=google.sc||{};google.sc.init=function(b,e,q,f,h,k,r){if((b=document.getElementById(b))&&(0!=b.offsetWidth||0!=b.offsetHeight)){var l=b.querySelector(""div""),m=l.querySelector(""div""),c=0,g=l.scrollWidth-l.offsetWidth;if(0<e){var n=m.children;c=n[e].offsetLeft-n[0].offsetLeft;if(f){for(var p=c=0;p<e;++p)c+=n[p].offsetWidth;c=Math.min(g,c)}}c+=q;e=Math.min(f?g-c:c,g);l.scrollLeft=f&&(h||r)?c:f&&k?-c:e;var a=b.getElementsByTagName(""g-left-button"")[0],d=b.getElementsByTagName(""g-right-button"")[0];a&&d&&(h=/\btHT0l\b/,k=/\bpQXcHc\b/,a.className=a.className.replace(h,""""),d.className=d.className.replace(h,""""),0==e?a.className=""pQXcHc ""+a.className:a.className=a.className.replace(k,""""),e==g?d.className=""pQXcHc ""+d.className:d.className=d.className.replace(k,""""),0<=a.className.indexOf(""SL0Gp"")&&0==e&&e==g&&(m.style.paddingLeft=""0px"",m.style.paddingRight=""0px"",a.style.display=""none"",d.style.display=""none"",b.style.paddingLeft=f?""0px"":""48px"",b.style.paddingRight=f?""48px"":""0px"",b.style.textAlign=f?""left"":""right"",document.getElementById(""fade_forward"").style.display=
""none"",document.getElementById(""fade_reverse"").style.display=""none""),setTimeout(function(){a.className+="" tHT0l"";d.className+="" tHT0l""},50))}};}).call(this);(function(){var id='_KtBwXdLfDuvTz7sPpvWD-Aw16';var index=0;var offset=0;var is_rtl=false;var is_ie=false;var is_gecko=false;var is_edge=false;google.sc.init(id,index,offset,is_rtl,is_ie,is_gecko,is_edge);})();Ask other people a questionPosting publicly. Learn more(function(){var a=document.querySelector(""#taw""),b=document.querySelector(""#topstuff"");if(a&&!a.clientHeight&&b&&!b.clientHeight)for(var c=document.querySelector(""#rso"").children,d=0;d<c.length;++d)if(0<c[d].clientHeight){var e=c[d].querySelector(""div g-section-with-header"");e&&(e.style.marginTop=0);break};}).call(this);Thanks for the upvote. Do you want to be notified when others post answers to this question?YesFollowing this question. You'll get notifications when people post new answers to this question."
Abstractor,"Q&A on GoogleWhat is career group? In context of employees job description.Report2 weeks agoAnswerwhat are the chiller plant Helpers Job Description ?Report5 months agoAnswerWhat is the Job profile of naval officer in tech entryReport3 months agoAnswerWhat is a cleaning supervisor job description?Report9 months agoAnswer(function(){google.sc=google.sc||{};google.sc.init=function(b,e,q,f,h,k,r){if((b=document.getElementById(b))&&(0!=b.offsetWidth||0!=b.offsetHeight)){var l=b.querySelector(""div""),m=l.querySelector(""div""),c=0,g=l.scrollWidth-l.offsetWidth;if(0<e){var n=m.children;c=n[e].offsetLeft-n[0].offsetLeft;if(f){for(var p=c=0;p<e;++p)c+=n[p].offsetWidth;c=Math.min(g,c)}}c+=q;e=Math.min(f?g-c:c,g);l.scrollLeft=f&&(h||r)?c:f&&k?-c:e;var a=b.getElementsByTagName(""g-left-button"")[0],d=b.getElementsByTagName(""g-right-button"")[0];a&&d&&(h=/\btHT0l\b/,k=/\bpQXcHc\b/,a.className=a.className.replace(h,""""),d.className=d.className.replace(h,""""),0==e?a.className=""pQXcHc ""+a.className:a.className=a.className.replace(k,""""),e==g?d.className=""pQXcHc ""+d.className:d.className=d.className.replace(k,""""),0<=a.className.indexOf(""SL0Gp"")&&0==e&&e==g&&(m.style.paddingLeft=""0px"",m.style.paddingRight=""0px"",a.style.display=""none"",d.style.display=""none"",b.style.paddingLeft=f?""0px"":""48px"",b.style.paddingRight=f?""48px"":""0px"",b.style.textAlign=f?""left"":""right"",document.getElementById(""fade_forward"").style.display=
""none"",document.getElementById(""fade_reverse"").style.display=""none""),setTimeout(function(){a.className+="" tHT0l"";d.className+="" tHT0l""},50))}};}).call(this);(function(){var id='_L9BwXbjSFcnXz7sP7teS4A013';var index=0;var offset=0;var is_rtl=false;var is_ie=false;var is_gecko=false;var is_edge=false;google.sc.init(id,index,offset,is_rtl,is_ie,is_gecko,is_edge);})();Ask other people a questionPosting publicly. Learn more(function(){var a=document.querySelector(""#taw""),b=document.querySelector(""#topstuff"");if(a&&!a.clientHeight&&b&&!b.clientHeight)for(var c=document.querySelector(""#rso"").children,d=0;d<c.length;++d)if(0<c[d].clientHeight){var e=c[d].querySelector(""div g-section-with-header"");e&&(e.style.marginTop=0);break};}).call(this);Thanks for the upvote. Do you want to be notified when others post answers to this question?YesFollowing this question. You'll get notifications when people post new answers to this question."
Academic Associate,"Accountant General Job Duties: Prepares asset, liability, and capital account entries by compiling and analyzing account information. Documents financial transactions by entering account information. ... Reconciles financial discrepancies by collecting and analyzing account information."
Academic Consultant,Accountants and auditors prepare and examine financial records. They ensure that financial records are accurate and that taxes are paid properly and on time. Accountants and auditors assess financial operations and work to help ensure that organizations run efficiently.
Academic Coordinator,"Primary responsibilities Oversee maintenance and operation of computer hardware systems. Control console of mainframe digital computer or set of minicomputers. Perform maintenance tasks such as checking for viruses, backing up tape, upgrading software, and other basic maintenance."
Academic Counsellor,"Accounting Manager Responsibilities Include: Managing and overseeing the daily operations of the accounting department. Monitoring and analyzing accounting data and produce financial reports or statements. Establishing and enforcing proper accounting methods, policies and principles."
Academic Head,"Accounting Assistant Responsibilities: Providing support to the Accounting Department. Performing basic office tasks, such as filing, data entry, answering phones, processing the mail, etc. Handling communications with clients and vendors via phone, email, and in-person.May 16, 2019"
Access Coordinator,"Account Executives work in many fields and help grow their companies by finding leads, closing sales, supporting existing clients, formulating sales strategies, and communicating product value to clients. They may also be known as Account Handlers.May 16, 2019"
Accessory Designer,"Administrative executives are the primary gatekeepers of the executive offices. They are responsible for the daily administrative activities of the executive offices. Such responsibilities include juggling phone calls, handling mail and offering administrative advice when needed.Dec 31, 2018"
Accountant,"Administrative Manager Responsibilities: Supervising day-to-day operations of the administrative department and staff members. ... Developing, reviewing, and improving administrative systems, policies, and procedures. Ensuring office is stocked with necessary supplies and all equipment is working and properly maintained.May 16, 2019"
Accountant & Administration,"Accounts Administrator responsibilities include reviewing and reconciling accounts, processing payments to external partners and maintaining updated records of invoices and receipts. To be successful in this role, you should have a Finance or Accounting background and be familiar with bookkeeping."
Accountant & Auditor,Audit assistants are entry-level auditing professionals who perform basic auditing tasks under the guidance of senior auditor. This position is often held by recent graduates or professionals new to the field of auditing. They monitor and analyze the financial reports of a company.
Accountant & Cashier,Top Audit Executive oversees all aspects of an organization's auditing function. Plans and directs all accounting and financial data. Being a Top Audit Executive designs internal auditing procedures and ensures they are followed. Monitors procedures for effectiveness and provides recommendations for improvement.
Accountant & Computer Operator,"Key Responsibilities Executives analyze financial reports and ledgers to innovate strategies that could edge the company over competitors. They'll order internal and external audits to double check that all regulations are running in compliance to industry regulations.Nov 1, 2016"
Accountant & Manager,"Accounting Manager Responsibilities Include: Managing and overseeing the daily operations of the accounting department. Monitoring and analyzing accounting data and produce financial reports or statements. Establishing and enforcing proper accounting methods, policies and principles."
Accountant & Office Assistant,"Accounting Assistant Responsibilities: Providing support to the Accounting Department. Performing basic office tasks, such as filing, data entry, answering phones, processing the mail, etc. Handling communications with clients and vendors via phone, email, and in-person.May 16, 2019"
Accountant Executive,"Accounting Assistant Responsibilities: Performing basic office tasks, such as filing, data entry, answering phones, processing the mail, etc. Handling communications with clients and vendors via phone, email, and in-person. Processing transactions, issuing checks, and updating ledgers, budgets, etc.May 16, 2019"
Accounts & Administration Executive,"Accounts assistant job descriptionWorking with spreadsheets, sales and purchase ledgers and journals.Preparing statutory accounts.Calculating and checking to make sure payments, amounts and records are correct.Sorting out incoming and outgoing daily post and answering any queries.Managing petty cash transactions.More items..."
Accounts & Administration Manager,"Career Requirements The key skills that a computer operator will need are time management, operation and control, critical thinking, complex problem solving, active listening, monitoring, reading comprehension, and operation monitoring."
Accounts & Administration Officer,"Accounting Assistant Responsibilities: Providing support to the Accounting Department. Performing basic office tasks, such as filing, data entry, answering phones, processing the mail, etc. Handling communications with clients and vendors via phone, email, and in-person.May 16, 2019"
Accounts & Audit Assistant,"Accounting Clerk Job Description. Accounting Clerks assist the Accounting Department with many of its administrative and clerical duties. They perform basic office tasks, assist with bookkeeping and reporting, and research and resolve discrepancies.May 16, 2019"
Accounts & Audit Executive,Account Director Responsibilities Include: Planning budgets and activities for account management in the company. Setting up goals and objectives for all subordinate staff. Providing feedback and counsel to account staff to meet quotas/objectives.
Accounts & Finance Executive,"Account Executives work in many fields and help grow their companies by finding leads, closing sales, supporting existing clients, formulating sales strategies, and communicating product value to clients. They may also be known as Account Handlers.May 16, 2019"
Accounts & Finance Manager,"Accounting Manager Responsibilities Include: Managing and overseeing the daily operations of the accounting department. Monitoring and analyzing accounting data and produce financial reports or statements. Establishing and enforcing proper accounting methods, policies and principles."
Accounts & Office Assistant,"Account management responsibilities include developing strong relationships with customers, connecting with key business executives and stakeholders and preparing sales reports. Account Managers also answer client queries and identify new business opportunities among existing customers."
Accounts Assistant,"Accounting Manager Responsibilities Managing and overseeing the daily operations of the accounting department. Monitoring and analyzing accounting data and produce financial reports or statements. Establishing and enforcing proper accounting methods, policies and principles."
Accounts Assistant & Cashier,"You will be responsible for developing long-term relationships with customers and overseeing sales. As a Sales account manager, you should work to satisfy customers' needs and requests, respond to their queries in a timely manner and aspire to deliver a positive customer experience."
Accounts Assistant & Computer Operator,"Job Description An accounts officer manages the financial bookkeeping of a business or organization. Each day, an accounts officer processes invoices, records payments, and track expenses of the organization. In some cases, an accounts officer supervises other staff members who assist with the bookkeeping duties.Jun 27, 2018"
Accounts Associate,Account Supervisor Responsibilities include: Manage account team and provide feedback. Maintain long-term and profitable customer relationships. Execute and supervise clients' marketing and communications plans.
Accounts Clerk,"Teachers create lesson plans and teach those plans to the entire class, individually to students or in small groups, track student progress and present the information to parents, create tests, create and reinforce classroom rules, work with school administration prepare students for standardized tests, and manage ...Feb 19, 2013"
Accounts Director,"Audit Trainee Responsibilities As an audit trainee, an employee has to follow the several formalities and process associated with auditing company accounts. Basically, he or she has to check client's financial statements to ensure the proper accounting of all the expenditure and receipts."
Accounts Executive,"As an acquisitions manager, you'll negotiate, seek out, finalize, and organize purchasing deals for your employer. In many cases, acquisitions are grouped with mergers and your main job function will be acquiring other companies and merging them into your company."
Accounts Head,"A team leader is responsible for guiding a group of employees as they complete a project. They are responsible for developing and implementing a timeline their team will use to reach its end goal. Some of the ways team leaders ensure they reach their goals is by delegating tasks to their members, including themselves."
Accounts Incharge,"The Role of the BRAND ACTIVATION SPECIALIST The Brand Activation Specialist builds content (text, pictures, info graphics, videos) and engaging experiences that will evangelize new and existing customers on BOARD MEETING's product offerings and brand."
Accounts Manager,"ActorInterpret serious or comic role by speech, gesture, and body movement to entertain or inform audience for stage, motion picture, television, radio, or other media production.Rehearse and memorize lines.Entertain, convey characters and express emotions in front of a live audience.Take cues from director.More items..."
Accounts Manager Sales,"In larger organizations, the general manager reports to a corporate executive, often the chief executive officer or chief operations officer."
Accounts Officer,"Account Executives work in many fields and help grow their companies by finding leads, closing sales, supporting existing clients, formulating sales strategies, and communicating product value to clients. They may also be known as Account Handlers.May 16, 2019"
Accounts Supervisor,"You will act as the first point of contact for HR-related queries from employees and external partners. Your main administrative duties include maintaining personnel records, managing HR documents (e.g. employment records and onboarding guides) and updating internal databases."
Accounts Teacher,"Administrative Assistant Responsibilities: Handling office tasks, such as filing, generating reports and presentations, setting up for meetings, and reordering supplies. ... Using computers to generate reports, transcribe minutes from meetings, create presentations, and conduct research. Greet and assist visitors.May 16, 2019"
Accounts Trainee,"Responsibilities. Administrative associates are typically responsible for handling the office budget and expenses, keeping office records updated, and administering company policies.Dec 27, 2018"
Acquisition Manager,Administrative Coordinator Job Responsibilities and Duties: Handles purchasing and maintenance of all general office supplies. Manages the company schedule and calendar and arranges travel. Screens and handles telephone communications and greets visitors to maintain a professional image.
Acting Team Leader,"Administrative executives are the primary gatekeepers of the executive offices. They are responsible for the daily administrative activities of the executive offices. Such responsibilities include juggling phone calls, handling mail and offering administrative advice when needed.Dec 31, 2018"
Activation Officer,"Administrative Manager Responsibilities: Supervising day-to-day operations of the administrative department and staff members. Hiring, training, and evaluating employees, taking corrective action when necessary. Developing, reviewing, and improving administrative systems, policies, and procedures.May 16, 2019"
Actress,"Administrative Manager Responsibilities: Supervising day-to-day operations of the administrative department and staff members. ... Developing, reviewing, and improving administrative systems, policies, and procedures. Ensuring office is stocked with necessary supplies and all equipment is working and properly maintained.May 16, 2019"
Additional General Manager,"Administrative Manager Responsibilities: Supervising day-to-day operations of the administrative department and staff members. Hiring, training, and evaluating employees, taking corrective action when necessary. Developing, reviewing, and improving administrative systems, policies, and procedures.May 16, 2019"
Administration & Accounts Executive,Include: Setting goals for performance and deadlines in ways that comply with company's plans and vision. Organizing workflow and ensuring that employees understand their duties or delegated tasks. Monitoring employee productivity and providing constructive feedback and coaching.
Administration & Human Resources Executive,"Admin assistants perform clerical duties in nearly every industry. ... Most administrative assistant duties revolve around managing and distributing information within an office. This generally includes answering phones, taking memos and maintaining files."
Administration Assistant,"A successful Administrative Officer will act as the point of contact for all employees, providing administrative support and managing their queries. Main duties include managing office stock, preparing regular reports (e.g. expenses and office budgets) and organizing company records."
Administration Associate,"In summary, the Secretary is responsible for: Ensuring meetings are effectively organised and minuted. Maintaining effective records and administration. Upholding the legal requirements of governing documents, charity law, company law etc (where relevant)."
Administration Coordinator,"Most administrative assistant duties revolve around managing and distributing information within an office. This generally includes answering phones, taking memos and maintaining files. Administrative assistants may also be in charge of sending and receiving correspondence, as well as greeting clients and customers."
Administration Executive,"Advertising Executives supervise the production of ad campaigns, and develop plans to increase sales for their clients' businesses. Advertising Executives are the liaison between their agency and its clients. While they don't actually write, they may be responsible for deciding the core message of a campaign."
Administration Head,"The advisor assists the leader/organization in formulating long-range goals and in planning and initiating short term projects. The advisor is a resource person, and evaluates projects, performance and progress. The advisor offers guidance by reviewing goals, objectives, and the progress of the organization."
Administration Incharge,"The projects you are involved in and the tasks you are given depend on the area you are working on, but general responsibilities include: conducting research, surveys and interviews to gain understanding of the business. analysing statistics. detecting issues and investigating ways to resolve them."
Administration Manager,Patient Advocate Job Duties: Resolves complaints by listening to patients and their families; directing them to a physician or supervisor; helping them present facts to the hospital representative; developing acceptable resolutions; following-up on outcomes.
Administration Supervisor,"A legal consultant can advise people, businesses or organizations with their legal obligations or problems. They provide legal advice by thoroughly investigating your matters. ... A legal consultant offers any relevant legal advice to their clients and ensures that their clients are in right standing with the law.Aug 14, 2017"
Administrative Assistant,"Legal Consultants They provide legal advice by thoroughly investigating your matters. They draft up legal documents that are necessary for the person or organization. A legal consultant offers any relevant legal advice to their clients and ensures that their clients are in right standing with the law.Aug 14, 2017"
