title,description
Chief Technology Officer,"Food Service Industry Job MarketExecutive Chef. Manages the kitchen staff, prepares work schedules, creates menus, and computes food costs.Sous Chef. ... Banquet Chef. ... Pastry Chef. ... Food Production Manager. ... Purchasing Manager. ... Private Club and Resort Manager. ... Institutional Food Service.More items..."
Chief Video Editor,"Custodians spend their days picking up trash, sweeping, mopping, vacuuming, or using industrial cleaning equipment to clean floors, cleaning and stocking bathrooms, making sure buildings are secure, cleaning windows, and minor building maintenance and repairs.Mar 7, 2013"
Choreographer,"Import Clerk jobs involve charging, costing and arranging the movement of goods and flow of paperwork to ensure Customs clearances are obtained quickly and deliveries are made in good time. An Import Clerk may work with imports that are shipped using sea, air and/or road freight."
Cinematographer,"Account management responsibilities include developing strong relationships with customers, connecting with key business executives and stakeholders and preparing sales reports. Account Managers also answer client queries and identify new business opportunities among existing customers."
Circle Head,Customer Service Representative Job Duties: Attracts potential customers by answering product and service questions; suggesting information about other products and services. Opens customer accounts by recording account information. Maintains customer records by updating account information.
Circle Security Manager,"Customer Service Associate Job Duties: Prepares for customer inquiries by studying products, services, and customer service processes. ... Improves quality service by recommending improved processes; identifying new product and service applications."
Circle Security Officer,"Customer service representatives help customers with complaints and questions, give customers information about products and services, take orders, and process returns. By helping customers understand the product and answering questions about their reservations, they are sometimes seen as having a role in sales.May 22, 2019"
Circulation Executive,"Customer Service Associates are responsible for assisting customers with any inquiries while ensuring the highest standards of customer service are met. Depending on the industry and company, duties vary from helping customers resolve purchasing problems to assisting customers with relevant products and services."
City Correspondent,"Client Service Consultant Responsibilities and Duties. Interact with customers to identify their business requirements. Develop business strategies to meet client needs and close sales. Provide client support services in timely, accurately and professional manner."
City Reporter,"Customer service representatives help customers with complaints and questions, give customers information about products and services, take orders, and process returns. By helping customers understand the product and answering questions about their reservations, they are sometimes seen as having a role in sales.May 22, 2019"
Civil Contractor,"Service Managers are typically responsible for managing service level agreements with customers and external service providers. The Service Manager role includes the following tasks: ... Assigning tasks to technicians throughout each work day that are based on SLAs, technician availability, and the technician's skills."
Civil Draftsman,Customer Service Representative Job Duties: Attracts potential customers by answering product and service questions; suggesting information about other products and services. Opens customer accounts by recording account information. Maintains customer records by updating account information.
Civil Engineer,"A customer service representative supports customers by providing helpful information, answering questions, and responding to complaints. They're the front line of support for clients and customers and they help ensure that customers are satisfied with products, services, and features.May 22, 2019"
Civil Executive,"Customer care specialists are the employees who are responsible for running a company's customer care hotline. Those who get to the specialist level often have a few years of experience working in a call center. ... Automotive, life insurance, and health insurance companies are some of their biggest employers."
Civil Foreman,"Facilitators' Role. Each group member is the expert of his or her own experience. The main goal of a facilitator is to draw out knowledge and insight from other group members. A facilitator will use different skills, tools, exercises and natural abilities to keep a group discussion moving smoothly."
Civil Judge,"The Job Role and Responsibilities The primary job roles and responsibilities of a customer support executive include: A professional approach in answering calls and provide information about products and services, taking input of issues and their redressal thereof. Maintaining records of transactions and interactions."
Civil Lawyer,"16 Customer Service Skills that Every Employee NeedsPatience. If you don't see this near the top of a customer service skills list, you should stop reading. ... Attentiveness. ... Clear communication skills. ... Knowledge of the Product. ... Ability to use positive language. ... Acting skills. ... Time management skills. ... Ability to 'read' customers.More items...â€¢Dec 30, 2018"
Civil Supervisor,"A customer relationship manager is typically responsible for customer relationships after the sale or service process is complete, and they continue to work with customers to keep them up to date on products and services to maintain that relationship.Jun 21, 2018"
Claim Processor,"A customer relationship manager is typically responsible for customer relationships after the sale or service process is complete, and they continue to work with customers to keep them up to date on products and services to maintain that relationship.Jun 21, 2018"
Claims Executive,"The quality of relationships a business has with its customers can impact its financial performance. A relationship sales officer is a professional whose overall responsibilities include managing customer expectations, identifying new business markets and recording daily customer transactions."
Claims Processing Executive,"The Job Role and Responsibilities The primary job roles and responsibilities of a customer support executive include: A professional approach in answering calls and provide information about products and services, taking input of issues and their redressal thereof. Maintaining records of transactions and interactions."
Clearcase Administrator,"As a sales representative or 'rep', it would be your job to sell your company's products or services. You would be responsible for finding and winning new customers, as well as looking after existing customer accounts. ... Making appointments with and meeting new customers. Agreeing sales, prices, contracts and payments."
Clearing Officer,"Customer service representatives help customers with complaints and questions, give customers information about products and services, take orders, and process returns. By helping customers understand the product and answering questions about their reservations, they are sometimes seen as having a role in sales.May 22, 2019"
Clerk,A service advisor typically works in a car dealership and is the liaison between the customer and service technicians working in the garage. They work with customers to determine problems with a vehicle and provide technicians with accurate repair descriptions.
Clerk & Cashier,"A customer service representative supports customers by providing helpful information, answering questions, and responding to complaints. They're the front line of support for clients and customers and they help ensure that customers are satisfied with products, services, and features.May 22, 2019"
Clerk & Computer Operator,"Server assistants, who are also called assistant servers, are people who help hosts and servers in restaurants, and are an integral part of a restaurant's staff. The job of a server assistant involves removing the dirty glassware, silverware, and plates after use by guests."
Clerk & Typist,"Customer Service Associates are responsible for assisting customers with any inquiries while ensuring the highest standards of customer service are met. Depending on the industry and company, duties vary from helping customers resolve purchasing problems to assisting customers with relevant products and services."
Client Relationship Executive,"Field Service Engineer job description. Field Service Engineers are required to design, install, or repair equipment related to different sectors of technology world. Their repair and installation duties may be performed at clientÂ´s home or in a place of business. ... Interacting with clients to solve their issues."
Client Sales Partner,"Customer Service Executives handle phone, internet and face to face interactions with customers. They manage client adjustments, claims, quotations, and process customer orders. They network with all groups and departments involved in customer orders, processing and support."
Client Servicing Executive,Customer services manager job descriptionHelping to build good customer relations.Recruiting staff and doing appraisals.Arranging staff meetings.Training and development.Handling complaints and queries (from customers and staff)Sorting security issues.Financial responsibilities.Arranging promotional events.
Clinical Assistant,Typical job responsibilities include: Communicating with clients and customers about their experiences with a product or service. Providing advice on purchasing products or services. ... Listening to customer or client complaints or concerns and working to resolve their issues.
Clinical Associate,"A customer service representative supports customers by providing helpful information, answering questions, and responding to complaints. They're the front line of support for clients and customers and they help ensure that customers are satisfied with products, services, and features.May 22, 2019"
Clinical Business Associate,"A customer service representative supports customers by providing helpful information, answering questions, and responding to complaints. They're the front line of support for clients and customers and they help ensure that customers are satisfied with products, services, and features.May 22, 2019"
Clinical Data Coordinator,Supervisor Duties & ResponsibilitiesHelping the team understand performance targets and goals.Training or ensuring that workers are properly trained for their specific roles.Scheduling work hours and shifts.Coordinating job rotation and cross-training.More items...
Clinical Data Manager,"Customer Service Associate Responsibilities: Processing and logging incoming calls into CRM system. Identifying customer needs. Forwarding and escalating inquiries to relevant individuals and departments. Contacting customers to give them accurate feedback on the progress of their inquiries.May 16, 2019"
Clinical Instructor,"The primary responsibility of a customer support engineer is to solve any technical issues a customer is having while using their new product or service. These issues are often related to software or hardware, so it's essential that customer support engineers have a solid grasp of computer systems.Jul 13, 2018"
Clinical Pharmacist,"Customer Support Executive Job Description. Customer support executives help an organization's clients with concerns. ... Jobs can be found in areas such as retail, financial services, technology, and others. Customer support executives typically work regular full-time hours in an office environment."
Clinical Physiotherapist,"A team leader is responsible for guiding a group of employees as they complete a project. They are responsible for developing and implementing a timeline their team will use to reach its end goal. Some of the ways team leaders ensure they reach their goals is by delegating tasks to their members, including themselves."
Clinical Psychologist,"Support managers supervise the maintenance and security of technical services and information within an organization, as well as ensuring adequate training and abilities of IT employees. ... Often delegating duties, support managers are ultimately responsible for the performance of systems and employees."
Clinical Research Assistant,"Customer service representatives help customers with complaints and questions, give customers information about products and services, take orders, and process returns. By helping customers understand the product and answering questions about their reservations, they are sometimes seen as having a role in sales.May 22, 2019"
Clinical Research Associate,"A customer service representative supports customers by providing helpful information, answering questions, and responding to complaints. They're the front line of support for clients and customers and they help ensure that customers are satisfied with products, services, and features.May 22, 2019"
Clinical Research Coordinator,"To guide cutting according to production planning. To ensure productivity in cutting department. ... To execute cutting according to production planning. Cutting Supervisor Job Description To ensure optimum productivity in cutting department.Sep 29, 2017"
Cluster Engineer,"As a pattern cutter, you'll create patterns based on drawings from a fashion designer. These patterns will then be used to make sample clothes, which will be used to refine the pattern and to produce a clothing line. Patterns may be created by hand or drawn in a computer program."
Cluster Head,"The average salary for a R&D Engineer is $99,095 per year in the United States."
Cluster Incharge,"During the engineering design process, the responsibilities of the engineer may include defining problems, conducting and narrowing research, analyzing criteria, finding and analyzing solutions, and making decisions. Much of an engineer's time is spent on researching, locating, applying, and transferring information."
Cluster Leader,"The Image Processing Engineer will create visual interpretations of data and methods, write reports, and create presentations. The Image Processing Engineer will work as part of a multidisciplinary team including expertise in chemistry, software, electronics, and mechanical design. US citizenship required."
Cluster Manager,"A signal processing engineer is an information technologies expert that analyzes and alters digital signals to make them more accurate and reliable. As a signal processing engineer, your responsibilities are to develop, manage and update digital signals, creating algorithms to process them more efficiently."
Co-Director,"The average salary for a Dsp Engineer is $103,405 per year in the United States.Jun 6, 2019"
Coach,"Desktop publishers typically do the following: Gather existing materials or work with designers and writers to create new artwork or text. Find and edit graphics, such as photographs or illustrations. Use scanners to turn drawings and other materials into digital images."
Cobol Developer,"DTP (desktop publishing) operators use specialist computer software to make sure that printed materials (such as books, newspapers, magazines and brochures) are well designed, attractive and easy to read. The work may involve: working to a design brief from the client or designer.Dec 10, 2012"
Cognos Consultant,"Graphic designers create visual concepts, by hand or using computer software, to communicate ideas that inspire, inform, or captivate consumers. They develop the overall layout and production design for advertisements, brochures, magazines, and corporate reports."
Cognos Developer,"DTP (desktop publishing) operators use specialist computer software to make sure that printed materials (such as books, newspapers, magazines and brochures) are well designed, attractive and easy to read. The work may involve: working to a design brief from the client or designer.Dec 10, 2012"
Cognos Report Developer,"Desktop publishers typically do the following: Gather existing materials or work with designers and writers to create new artwork or text. Find and edit graphics, such as photographs or illustrations. Use scanners to turn drawings and other materials into digital images."
Collection Agent,"Desktop publishers typically do the following: Gather existing materials or work with designers and writers to create new artwork or text. Find and edit graphics, such as photographs or illustrations. Use scanners to turn drawings and other materials into digital images."
Collection Executive,"Desktop publishers typically do the following: Gather existing materials or work with designers and writers to create new artwork or text. Find and edit graphics, such as photographs or illustrations. Use scanners to turn drawings and other materials into digital images."
Collection Manager,"Dance Teachers are responsible for leading dance classes for individual or groups of people. Their duties are closely related to teaching various dancing techniques. They may work at production companies and also at schools, universities, and colleges. ... Adapting teaching methods to meet studentÂ´s needs."
Collection Officer,Database Administrator Duties & Responsibilities Supervision of modifications to any existing database software to meet the needs of their employer. Responsibility for maintaining the integrity and performance of company databases.
Collection Supervisor,"A Data Analyst interprets data and turns it into information which can offer ways to improve a business, thus affecting business decisions. Data Analysts gather information from various sources and interpret patterns and trends â€“ as such a Data Analyst job description should highlight the analytical nature of the role."
Collections Manager,"Database Architect Job Duties: Maintains database performance by identifying and resolving production and application development problems; calculating optimum values for parameters; evaluating, integrating, and installing new releases; completing maintenance; answering user questions."
Colonel,Database Administrator Duties & Responsibilities Supervision of modifications to any existing database software to meet the needs of their employer. Responsibility for maintaining the integrity and performance of company databases. ... Informing end users of changes in databases and train them to utilize systems.
Colour Consultant,Database Administrator Duties & Responsibilities Supervision of modifications to any existing database software to meet the needs of their employer. Responsibility for maintaining the integrity and performance of company databases. ... Informing end users of changes in databases and train them to utilize systems.
Columnist,Years of Experience: Education Level
Commandant,"Database administrator. Database administrators (DBAs) use specialized software to store and organize data. The role may include capacity planning, installation, configuration, database design, migration, performance monitoring, security, troubleshooting, as well as backup and data recovery."
Commander,"Database administrator. Database administrators (DBAs) use specialized software to store and organize data. The role may include capacity planning, installation, configuration, database design, migration, performance monitoring, security, troubleshooting, as well as backup and data recovery."
Commanding Officer,"As a database administrator, you'll be responsible for the performance, integrity and security of a database. However, depending on the organisation and your level of responsibility, the role can vary from inputting information through to total management of data. ... Monitoring database efficiency."
Commerce Lecturer,"Data conversion operators are entry level positions with the US Postal Service who help to prepare mail and parcels for automated sorting. As the mail is passed through a postal processing center, data conversion operators input the handwritten or typed address information on the envelope into a sorting computer."
Commerce Teacher,"Data conversion specialists typically have supervisors and work indoors on a computer during regular business hours. ... These specialists are responsible for developing the process of converting data and must be able to work with tools such as Word, Excel, Access, and electronic databases of all kinds."
Commercial Artist,Data conversion process steps include: Extracting data from legacy system. Tracking changes in anticipation of dual maintenance. Importing data into scrub environment.
Commercial Assistant,"Growth Trends for Related Jobs A data encoder is another name for a data entry clerk. Typically, a data encoder is responsible for compiling, sorting and processing data. Encoders may also need to do filing and organizing as part of their job duties.Aug 10, 2018"
Commercial Executive,"Data entry operator responsibilities include collecting and entering data in databases and maintaining accurate records of valuable company information. Our ideal candidate has essential data entry skills, like fast typing with an eye for detail and familiarity with spreadsheets and online forms."
Commercial Manager,"Data Entry Operator job profile Data Entry Operators are usually responsible for entering data into different computer databases, manage and maintain effective record keeping. In addition, they may be responsible for organizing files, collecting and managing data to be entered into the computer."
Commercial Officer,"The main purpose of Data Managers is to oversee a company's various data systems. They are responsible for organizing, storing and analyzing data as efficiently as possible, while always upholding agreed-upon security standards. ... Any organization that produces and utilizes large amounts of data may hire a Data Manager."
Commercial Staff,"Data Entry Operator job profile Data Entry Operators are usually responsible for entering data into different computer databases, manage and maintain effective record keeping. In addition, they may be responsible for organizing files, collecting and managing data to be entered into the computer."
Commercial Trainee,"Data Engineers' Responsibilities The data engineer is someone who develops, constructs, tests and maintains architectures, such as databases and large-scale processing systems. ... The data engineers will need to recommend and sometimes implement ways to improve data reliability, efficiency, and quality.Feb 23, 2017"
Commission Agent,"The major responsibility of process executive is to handle all the business processes. He take cares of everything like how the organization is moving, its ethics, whether it's achieving its goals etc. The Responsibility of Processes executive is to design and deliver value to the customer at the desired time.Apr 11, 2018"
Commissioned Officer,"Job Description The Transaction Processing Officer is accountable for transactions of a financial and non financial nature related to account maintenance processing; posting customer deposits, related suspense account entries and adjustments and processing wires and transfers.Jan 9, 2015"
Commissioning Engineer,"Data Entry Operator job profile Data Entry Operators are usually responsible for entering data into different computer databases, manage and maintain effective record keeping. In addition, they may be responsible for organizing files, collecting and managing data to be entered into the computer."
Communication Officer,A Loan Processor evaluates the eligibility of people and businesses based on submitted loan applications. They act as a liaison between customers and financial institutions who assist qualified applicants acquire loans in a timely manner.
Communications Manager,Database Administrator Duties & Responsibilities Responsibility for maintaining the integrity and performance of company databases. Must guarantee that data is stored securely and optimally. Informing end users of changes in databases and train them to utilize systems.
Company Commander,"IT database administrator. As a database administrator, you'll be responsible for the performance, integrity and security of a database. ... Setting up and testing new database and data handling systems. Monitoring database efficiency."
Company Secretary,"Analysts help businesses by synthesizing external and internal data and communicating them clearly to all stakeholders, facilitators and partners. An analyst is principally responsible for interpreting data, formulating reports and making recommendations based upon the research findings."
Company Secretary & Compliance Officer,"Database Architect Job Duties: Determines database structural requirements by analyzing client operations, applications, and programming; reviewing objectives with clients; evaluating current systems; ... Provides database support by coding utilities, responding to user questions, and resolving problems."
Company Secretary & Legal Head,"What Does A Database Consultant Do. Database administrators use specialized software to store and organize data, such as financial information and customer shipping records. They make sure that data are available to users and are secure from unauthorized access."
Company Secretary & Legal Manager,"The database designer is responsible for defining the detailed database design, including tables, indexes, views, constraints, triggers, stored procedures, and other database-specific constructs needed to store, retrieve, and delete persistent objects. This information is maintained in the Artifact: Data Model."
