title,description
Lecturer Zoology,"Manager Job Duties: Accomplishes staff results by communicating job expectations; planning, monitoring, and appraising job results; coaching, counseling, and disciplining employees; developing, coordinating, and enforcing systems, policies, procedures, and productivity standards."
Legal & Administration Executive,"Merchandiser Responsibilities Planning and developing merchandising strategies. Analyzing sales figures, customers reactions and market trends to anticipate product needs. Collaborating with buyers, suppliers, distributors and analysts to negotiate prices, quantities and time-scales."
Legal & Administration Manager,"Job Duties The main task of a scanning clerk is to produce digital copies of documents for retention purposes. ... Depending on the position, the scanning clerk might also be responsible for organizing scanned documents on various local, network and cloud storage devices."
Legal & Administration Officer,"Job Duties The main task of a scanning clerk is to produce digital copies of documents for retention purposes. ... Depending on the position, the scanning clerk might also be responsible for organizing scanned documents on various local, network and cloud storage devices."
Legal & Company Secretary Manager,"Job Description of an Executive They analyze sales reports, financial statements, and oversee the general activities that make up the mission of the company. Executives are responsible for the company's budgetary and financial activities and would be involved with approving and/or negotiating contracts or agreements."
Legal & Compliance Manager,Classroom assistants help teachers perform different tasks in the classroom. They aim to work in such a way that allows teachers to focus solely upon teaching the students and setting tasks for them to complete. Classroom assistants provide support for teachers whilst they perform their daily tasks in the classroom.
Legal & Compliance Officer,Counsellors provide support to people experiencing emotional difficulties by helping them to identify and work through their issues. A Counsellor uses techniques such as talking therapy to assist people to reach their own resolutions or develop strategies to address and remedy their concerns.
Legal & Secretarial Executive,Duties and Responsibilities of a TeacherTo plan and prepare appropriately the assigned courses and lectures.To conduct assigned classes at the scheduled times.To demonstrate competence in classroom instruction.To implement the designated curriculum completely and in due time.To plan and implement effective classroom management practices.More items...
Legal & Secretarial Manager,"Teachers create lesson plans and teach those plans to the entire class, individually to students or in small groups, track student progress and present the information to parents, create tests, create and reinforce classroom rules, work with school administration prepare students for standardized tests, and manage ...Feb 19, 2013"
Legal Advisor,SSC Scientific Assistant IMD Exam. The Staff Selection Commission conducts the Scientific Assistants exam in Indian Meteorological Department (IMD).
Legal Affairs Manager,"A scientific officer, or natural science manager, is an experienced scientific researcher, often in charge of research and development within their field. They perform many administrative and managerial duties, and often hold an advanced degree."
Legal Analyst,"Sales Executive Job Duties: Sells products by establishing contact and developing relationships with prospects; recommending solutions. Maintains relationships with clients by providing support, information, and guidance; researching and recommending new opportunities; recommending profit and service improvements."
Legal Attorney,"The role of the research scientist is to set up and carry through experiments in order to broaden mankind's scientific knowledge in a particular area. ... Many research scientists work in teams with a variety of support staff, and they are found in a variety of industries, from pharmaceuticals to marine exploration."
Legal Consultant,"Applications are invited from Graduate Aptitude Test in Engineering (GATE)-2018 qualified. candidates for filling up of Nine (09) posts of Scientist 'B' (Group 'A' Gazetted) in the Ministry of New and. Renewable Energy (MNRE), on direct recruitment basis. The brief details of the posts are as under: 1."
Legal Coordinator,"Research scientists are responsible for designing, undertaking and analysing information from controlled laboratory-based investigations, experiments and trials. You could work for government laboratories, environmental organisations, specialist research organisations or universities."
Legal Counsel,"Screenwriter Duties & Responsibilities The job generally requires the ability to perform the following duties: Develop and research ideas for original movie screenplays. Create an initial framework, or treatment, for screenplays. ... Work with producers and directors to edit and adjust the script as needed."
Legal Editor,"Functional consultants are responsible for driving business meetings, preparing business case documents and communicating client requirements to the technical consultants. They also configure the SAP system to run as per the client's requirements. ... SAP has many modules like SAP ABAP, Sap Successfactors, FICO etc.Jul 27, 2015"
Legal Executive,SEO Specialist Responsibilities Optimizing copy and landing pages for search engine optimization. Performing ongoing keyword research including discovery and expansion of keyword opportunities. Researching and implementing content recommendations for organic SEO success.
Legal Intern,"Their specific plans and designs are then executed in tangible materials. The chief engineer is responsible for the technical supervision of the development, production or operation of an engineering project for a multinational corporation, a major company or a government institution."
Legal Manager,Divestopedia explains Second In Command (2IC) The 2IC is the most important position needed to strengthen the management team. It allows the business owner to remove him/herself from the company with the confidence that the company will carry on running the same in their absence.
Legal Officer,"Job Duties and Tasks for: ""Secondary School Teacher"" 1) Establish and enforce rules for behavior and procedures for maintaining order among the students for whom they are responsible. 2) Instruct through lectures, discussions, and demonstrations in one or more subjects such as English, mathematics, or social studies."
Legal Practitioner,"Teachers create lesson plans and teach those plans to the entire class, individually to students or in small groups, track student progress and present the information to parents, create tests, create and reinforce classroom rules, work with school administration prepare students for standardized tests, and manage ...Feb 19, 2013"
Legal Professional,"Teachers create lesson plans and teach those plans to the entire class, individually to students or in small groups, track student progress and present the information to parents, create tests, create and reinforce classroom rules, work with school administration prepare students for standardized tests, and manage ...Feb 19, 2013"
Legal Representative,"Duties, responsibilities and functions. An assistant helps with time and daily management, scheduling of meetings, correspondence, and note-taking. The role of a personal assistant can be varied, such as answering phone calls, taking notes, scheduling meetings, emailing, texts etc."
Legal Researcher,"Especially in small offices, the functions of a secretary may include routine clerical tasks and errands to assist others. This may mean canceling or rescheduling appointments, ordering office supplies, taking notes during meetings and getting drinks for guests.Sep 24, 2018"
Legal Retainer,"Especially in small offices, the functions of a secretary may include routine clerical tasks and errands to assist others. This may mean canceling or rescheduling appointments, ordering office supplies, taking notes during meetings and getting drinks for guests.Sep 24, 2018"
Legal Secretary,"Your clerical and administrative support will assist office personnel and optimize workflow. You need to be comfortable being the primary point of contact for all manners of inquiries and requests. Other secretarial responsibilities will include organizing and maintaining files, supplies, and equipment."
Legal Specialist,Related searchesView 5+ moreView 5+Personal Assistant job desc...Office manager job desc...Clerk job descriptionIT manager job desc...Treasurer job descriptionCashier job descriptionAccountant job description
Legal Supervisor,"Receptionist Responsibilities: Receiving visitors at the front desk by greeting, welcoming, directing and announcing them appropriately. Answering screening and forwarding incoming phone calls. Receiving and sorting daily mail."
Legal Trainee,"Especially in small offices, the functions of a secretary may include routine clerical tasks and errands to assist others. This may mean canceling or rescheduling appointments, ordering office supplies, taking notes during meetings and getting drinks for guests.Sep 24, 2018"
Liaison Officer,"Executive Secretary Responsibilities Include: Maintaining executive's agenda and assist in planning appointments, board meetings, conferences etc. Attending meetings and keep minutes. Receiving and screening phone calls and redirecting them when appropriate."
Librarian,"A general manager's secretary is responsible for carrying out clerical, phone and administrative responsibilities while simultaneously representing the executive office. She must be detail oriented, have the ability to multitask and be a personable and professional representative of the general manager's office."
Library Assistant,"Assistant General Manager Job Description Template. It will be your job to aid the general manager in coordinating, directing and planning everyday business operations. You'll help create weekly schedules, ensure shifts go smoothly, manage daily operations and help with human resources as necessary."
Library Trainee,"Job Summary Responsible for supporting high-level executives and management or entire departments. Provides administrative support and performs numerous duties, including scheduling, writing correspondence, emailing, handling visitors, routing callers, and answering questions and requests."
Lieutenant,"The average salary for an Executive Assistant to CEO is $60,389.Jul 10, 2019"
Lieutenant Colonel,"Responsible for supporting high-level executives and management or entire departments. Provides administrative support and performs numerous duties, including scheduling, writing correspondence, emailing, handling visitors, routing callers, and answering questions and requests."
Life Advisor,"Especially in small offices, the functions of a secretary may include routine clerical tasks and errands to assist others. This may mean canceling or rescheduling appointments, ordering office supplies, taking notes during meetings and getting drinks for guests.Sep 24, 2018"
Life Insurance Advisor,"The Lieutenant is assisted by Sergeant. As a team, they make up the Platoon Headquarters and are responsible for the platoon's leadership, instruction, discipline, administration and welfare throughout the conduct of training. The Platoon Commander is a graduate of the Royal Military College â€“ Duntroon."
Life Insurance Agent,"Administrative Manager Responsibilities: Supervising day-to-day operations of the administrative department and staff members. Hiring, training, and evaluating employees, taking corrective action when necessary. Developing, reviewing, and improving administrative systems, policies, and procedures.May 16, 2019"
Lighting Artist,"Duties. In order to adequately protect people and property, security guards must know and enforce rules and regulations to prevent criminal activity before it happens. ... If working after hours, they may maintain surveillance of a property by patrolling the grounds or using closed-circuit monitoring or alarm systems."
Lighting Designer,Related searchesSecurity analyst job desc...Security Engineer job desc...Operations Administrator job desc...
Line Cook,"Security Officer Job Duties: Prevents losses and damage by reporting irregularities; informing violators of policy and procedures; restraining trespassers. ... Completes reports by recording observations, information, occurrences, and surveillance activities; interviewing witnesses; obtaining signatures."
Line Leader,"Information Security Analyst Responsibilities: Monitor computer networks for security issues. Investigate security breaches and other cyber security incidents. Install security measures and operate software to protect systems and information infrastructure, including firewalls and data encryption programs.May 16, 2019"
Line Producer,"A security assistant is responsible for handling security equipment such as electronic surveillance devices, two-way radios and alarms. ... In case of loss, vandalism, sabotage, theft or malfunction of any security device, he reports the matter to the security officer."
Line Supervisor,Related searchCertifications for information securityCertified Information Systems...Computer securityCompTIACertified Information Security...Certified Ethical Hacker
Linear Editor,"Information Security Engineer Job Description. Information Security Engineers, also called Information Security Analysts, help to safeguard organization's computer networks and systems. They plan and carry out security measures to monitor and protect sensitive data and systems from infiltration and cyber-attacks."
Linear Video Editor,"Training Facilitator responsibilities include: Interviewing staff and managers to assess training needs. Designing training curriculum. Organizing in-house and offsite activities, like presentations, job simulations and role-playing exercises."
Link Builder,"Security Guard job profile To write an effective Security Guard job description, you need to understand what exactly a Security Guard does. Security Guards duties often include securing premises and personnel by patrolling property, monitoring surveillance equipment and inspecting buildings and equipment."
Link Building Executive,"Security Officer Job Duties: Secures premises and personnel by patrolling property; monitoring surveillance equipment; inspecting buildings, equipment, and access points; permitting entry. Obtains help by sounding alarms."
Linux Administrator,"Security Officer Job Duties: Secures premises and personnel by patrolling property; monitoring surveillance equipment; inspecting buildings, equipment, and access points; permitting entry. Obtains help by sounding alarms."
Linux Engineer,"Security Manager job profile Security Managers are usually responsible for planning, implementing and overseeing the overall monitoring the overall security operations of a company."
Linux Support Engineer,"Secures premises and personnel by patrolling property; monitoring surveillance equipment; inspecting buildings, equipment, and access points; permitting entry. Obtains help by sounding alarms. Prevents losses and damage by reporting irregularities; informing violators of policy and procedures; restraining trespassers."
Linux System Administrator,"Security Officer Job Duties: Secures premises and personnel by patrolling property; monitoring surveillance equipment; inspecting buildings, equipment, and access points; permitting entry. Obtains help by sounding alarms."
Lobby Manager,"Security Officer Job Duties: Secures premises and personnel by patrolling property; monitoring surveillance equipment; inspecting buildings, equipment, and access points; permitting entry. Obtains help by sounding alarms. ... Maintains environment by monitoring and setting building and equipment controls."
Location Head,"Computer security specialists use their skills and knowledge to prevent cyber attacks on information systems and to keep criminals from gaining access to financial information, military secrets and other confidential data."
Logistics Assistant,"Duties may include issuance and maintenance of access cards and keys, supervision of security and/or clerical support staff, monitoring of alarm systems, preparation of clearance forms, and maintenance of security documents and other data in either hard copy or computerized formats.Mar 20, 2017"
Logistics Coordinator,"Senior Accountant Job Duties: Prepares and records asset, liability, revenue, and expenses entries by compiling and analyzing account information. ... Maintains general ledger by transferring subsidiary accounts; preparing a trial balance; reconciling entries."
Logistics Executive,"The Senior Account Executive is responsible for achieving sales and/or profitability objectives, typically from new clients or accounts. Senior Account Executives identify marketplace opportunities, prospect and engage new clients, develop proposals, and manage the contract process."
Logistics Incharge,Administration Manager Responsibilities Planning and coordinating administrative procedures and systems and devising ways to streamline processes. Recruiting and training personnel and allocate responsibilities and office space. Assessing staff performance and provide coaching and guidance to ensure maximum efficiency.
Logistics Manager,"As a supervisor, the senior animator will monitor the work of junior animators and ensure the artistic integrity and quality of assets produced by the department. ... In coordination with the senior development staff, the senior animator must establish and enforce workflow procedures and effective pipeline practices."
Logistics Officer,"SADs maintain the job duties of a supervisor as well as a lower-level application developer or engineer. These duties can include regular consultations with clients concerning software, creating new programs, and testing newly installed programs to verify functionality."
Logistics Supervisor,"Should I Become a Senior Architect? Senior architects are licensed architects with additional responsibilities. In addition to designing building plans, they may be in charge of preparing bids and project proposals, managing staff, and completing projects from design through construction."
Loss Prevention Executive,"The job description for a senior executive assistant comprises many high-level administrative support duties. These include the following: Schedule management. A senior executive assistant coordinates the schedule of his boss, ensuring that meetings, deadlines, presentations and other duties are carried out seamlessly.Jun 29, 2018"
Loss Prevention Manager,"Routine tasks typically include conceptualizing and pitching stories, conducting research, interviewing sources, writing and editing copy, selecting photos and art to accompany articles, and proofreading. Some assistant editors may also manage social media accounts, and repurpose and curate content."
Loss Prevention Officer,"Related searchTop global law firmsView 3+ moreView 3+Baker McKenzieKirkland & EllisCravath, Swaine & MooreAllen & OveryClifford ChanceJones DayLinklaters"
Lotus Domino Administrator,"Related searchArchitecture AssociateView 3+ moreView 3+American Institute of ArchitectsReynolds, Smith & HillsStantecArup GroupSkidmore, Owings & MerrillCannonDesignHNTB"
Lotus Notes Administrator,"What Does an Associate Attorney Do? ... Under the guidance of an experienced attorney or a partner in the firm, associate attorneys assist with cases by conducting legal research and writing reports, legal briefs, and other documents."
Lotus Notes Developer,Job Duties: Reviewing and editing copies; enf...
Lower Division Clerk,"Human Resources Associate Job Duties: Maintains human resources records by maintaining applications, rÃ©sumÃ©s, and applicant logs. Verifies candidates background by contacting references. Enrolls new employees by issuing forms and applications; verifying completion. Helps employees by explaining benefit programs."
MCR Executive,Include: Oversee and direct a compliant and accurate auditing process. Supervise and coach junior and staff auditors. Ensure efficiency of internal controls.
MD,"Auditor Job Duties:Ensures compliance with established internal control procedures by examining records, reports, operating practices, and documentation.Verifies assets and liabilities by comparing items to documentation.Completes audit workpapers by documenting audit tests and findings.More items..."
MEP Coordinator,"Branch Manager Responsibilities Include: Directing all operational aspects including distribution, customer service, human resources, administration and sales in accordance with the bank's objectives. Providing training, coaching, development and motivation for bank personnel."
MEP Engineer,"Top-earning brewmasters can make as much as $100,000 a year at a national brewery, whereas those working for a craft brewpub can earn as little as $25,000 annually, as of 2012. The national average, however, puts the annual mean for a master brewer between $30,000 and $50,000."
MIS Analyst,"Developing technical solutions to business problems, or to advance a company's sales efforts, begins with defining, analyzing and documenting requirements. Managing requirements at the project level can help fulfill business needs. Business analysts typically take the lead role in: ... Requirements organization.Feb 22, 2019"
MIS Assistant,"Senior Business Analyst Job Description. The Senior Business Analyst provides strategic business analysis services to business partners. ... The Senior Business Analyst is responsible for reviewing assigned business processes from end-to-end to identify and address operational, financial and technological risks."
MIS Coordinator,Business Consultant Responsibilities Include: Organizing and executing assigned business projects on behalf of clients according to client's requirements. Meeting with assigned clients when needed and perform an initial assessment of a problematic situation.
MIS Executive,Examples of Business Development Executive responsibilities Oversee the sales process to attract new clients. Work with senior team members to identify and manage risks. Maintain fruitful relationships with clients and address their needs effectively.
MIS Head,"Your job as a business development manager is to identify sales leads, pitch goods or services to new clients and maintain a good working relationship with new contacts. ... Communicating new product developments to prospective clients. Overseeing the development of marketing literature.Jun 19, 2019"
MIS Incharge,"Business executives are responsible for not only establishing corporate goals, policies, and procedures, but also making sure they're carried out appropriately. Often, new policies are established by the chief executive officer through a collaboration with other top ranking executives within the organization."
MIS Manager,"Job Description and Duties Business managers oversee the activities of workers; hire, train and evaluate new employees; and ensure that a company or department is on track to meet its financial goals. ... Managers assess the performance of the department or company against the business's goals and plans."
MIS Officer,"Working As A Senior Buyer They evaluate suppliers, negotiate contracts, and review the quality of products. Buyers and purchasing agents typically do the following: ... Negotiate contracts on behalf of their organization."
MIS Operator,"Position Summary: As a Chef De Partie (CDP) you are responsible supporting the Head and Sous Chef in a busy hotel kitchen delivering consistently high-quality food, handle purchase orders and ensure that items arriving without authorization are not received."
MQ Administrator,Related searchFields of engineeringCivil EngineeringElectrical engineeringEnvironmental engineeringStructural engineeringComputer EngineeringChemical Engineering
MRE,Related searchParamilitary organizations in IndiaCentral Armed Police F...Sashastra Seema BalCentral Industrial Security...Central Reserve Police F...Border Security ForceIndoâ€‘Tibetan Border Police
MS SQL Data Base Administrator,Related searchEngineering industries listView 3+ moreView 3+Civil EngineeringStructural engineeringElectrical engineeringEnvironmental engineeringConstruction engineeringEngineeringComputer Engineering
MTS,Related searchContent writing industryContent creationContent marketingSearch Engine OptimizationCopywriting
MTS TQE,Related searchContent writing industrySearch Engine OptimizationContent marketingCopywritingContent creation
